{
  "schemaVersion": "1",
  "auditId": "AUDIT-EXAMPLE-001",
  "targetRevision": "exact-git-revision",
  "findings": [
    {
      "id": "FINDING-001",
      "invariantIds": ["HC-CTX-001"],
      "priority": "important_correction",
      "risk": "Describe the behavior or invariant at risk.",
      "evidence": [
        {
          "path": "docs/example.md",
          "lineStart": 1,
          "lineEnd": 1,
          "observation": "Describe the concrete observation."
        }
      ],
      "lifecycleOrDecision": "Name the relevant lifecycle phase or accepted decision.",
      "semanticOwner": "Name the earliest owner.",
      "proofGap": "Explain why current proof did not catch the issue.",
      "rootCorrection": "Describe the smallest root correction.",
      "retire": ["Name weaker duplicated reminders or machinery to retire."],
      "surfaces": {
        "docs": { "decision": "change_required", "evidence": ["Name exact owner paths."] },
        "readmes": {
          "decision": "not_applicable",
          "evidence": ["Explain inspected no-impact evidence."]
        },
        "architecture_standards": {
          "decision": "not_applicable",
          "evidence": ["Explain inspected no-impact evidence."]
        },
        "runbooks": {
          "decision": "not_applicable",
          "evidence": ["Explain inspected no-impact evidence."]
        },
        "proof_evidence": { "decision": "change_required", "evidence": ["Name proof required."] },
        "skills": {
          "decision": "not_applicable",
          "evidence": ["Explain inspected no-impact evidence."]
        },
        "lint_config_ci": {
          "decision": "not_applicable",
          "evidence": ["Explain inspected no-impact evidence."]
        },
        "spec_tasks": {
          "decision": "change_required",
          "evidence": ["Accepted finding must map into planning."]
        },
        "tests_fixtures": {
          "decision": "not_applicable",
          "evidence": ["Explain inspected no-impact evidence."]
        },
        "config_exports": {
          "decision": "not_applicable",
          "evidence": ["Explain inspected no-impact evidence."]
        },
        "lifecycle": {
          "decision": "not_applicable",
          "evidence": ["Explain inspected no-impact evidence."]
        },
        "release_rollback": {
          "decision": "not_applicable",
          "evidence": ["Explain inspected no-impact evidence."]
        },
        "critical_journeys": {
          "decision": "change_required",
          "evidence": ["Name affected journey IDs."]
        }
      },
      "verification": ["Name exact repository-owned commands or procedures."],
      "journeyIds": ["JOURNEY-001"],
      "authorityOrDecision": "Name required authority or state none.",
      "limitations": ["Name what evidence cannot establish."],
      "nonClaims": ["Name claims intentionally not made."],
      "decision": "proposed"
    }
  ],
  "foundationsToPreserve": [],
  "limitations": ["Name audit-wide limitations."],
  "nonClaims": ["Name audit-wide non-claims."]
}
